{
    "id": "sloppy-joe-casserole",
    "name": "Sloppy Joe Casserole",
    "ingredients": [
      "1 1/2 pounds ground beef",
      "2 1/2 ounces onion, chopped fine, 1 small",
      "2 stalks celery, chopped fine",
      "1 clove garlic, minced",
      "1/2 cup tomato sauce",
      "2 teaspoons granular Splenda",
      "1 tablespoon vinegar",
      "1 tablespoon Worcestershire sauce",
      "1 teaspoon mustard",
      "1/2 teaspoon salt",
      "1/4 teaspoon pepper",
      "4 medium zucchini, 28 ounces total",
      "8 ounces cheddar cheese, shredded"
    ],
    "utensils": [
      "Large skillet",
      "Large casserole dish",
      "Microwave"
    ],
    "cookingTime": 30,
    "prepTime": 20,
    "instructions": [
      {
        "time": 10,
        "en": "Brown ground beef, onion, celery, and garlic in a large skillet; drain fat.",
        "sk": "Opečte mleté mäso, cibuľu, zeler a cesnak na veľkej panvici; zlejte tuk.",
        "ja": "大きなフライパンで挽肉、玉ねぎ、セロリ、ニンニクを炒めて茶色くし、脂を切ります。",
        "primaryIngredient": "ground beef mixture"
      },
      {
        "time": 20,
        "en": "Add remaining ingredients except zucchini and cheese. Simmer covered for 10-20 minutes.",
        "sk": "Pridajte zvyšné prísady okrem cukety a syra. Varte prikryté 10-20 minút.",
        "ja": "ズッキーニとチーズ以外の残りの材料を加えます。蓋をして10〜20分間煮込みます。",
        "primaryIngredient": "sloppy joe sauce"
      },
      {
        "time": 10,
        "en": "Slice zucchini into half moons. Cook until tender but not too soft; drain well.",
        "sk": "Nakrájajte cuketu na polmesiace. Varte, kým nezmäkne, ale nie príliš; dobre sceďte.",
        "ja": "ズッキーニを半月形に切ります。柔らかくなるまで調理しますが、煮すぎないようにし、よく水気を切ります。",
        "primaryIngredient": "zucchini"
      },
      {
        "time": 5,
        "en": "Mix meat mixture, zucchini, and cheese in a large casserole dish. Season to taste.",
        "sk": "Zmiešajte mäsovú zmes, cuketu a syr vo veľkej zapekacej miske. Ochuťte podľa chuti.",
        "ja": "大きなキャセロール皿に肉の混ぜ物、ズッキーニ、チーズを混ぜ合わせます。味を調えます。",
        "primaryIngredient": "assembled casserole"
      },
      {
        "time": 10,
        "en": "Microwave until hot and bubbly, stirring occasionally.",
        "sk": "Ohrievajte v mikrovlnnej rúre, kým nebude horúce a bublajúce, občas premiešajte.",
        "ja": "時々かき混ぜながら、熱々になり泡立つまで電子レンジで加熱します。",
        "primaryIngredient": "heated casserole"
      }
    ],
    "favorite": false,
    "recipeType": "keto-main",
    "notes": "Makes 6-8 servings. Can be frozen but may get watery.",
    "nutritionalInformation": {
      "amount": "Per 1/6 Recipe",
      "calories": "378",
      "protein": "30g",
      "carbohydrates": "8g",
      "fat": "25g"
    }
  }